{
  "protocol_version": "0.1",
  "evidence_channels": ["runtime"],
  "run_id": "delivery-001",
  "status": "owner_review_required",
  "delivery_directory": "/workspace/out/deliveries/delivery-001",
  "project_root": "/workspace/example-project",
  "safety": {
    "staged_copy_required": true,
    "apply_requires_run_id_confirmation": true,
    "automatic_source_edits": false,
    "backup_required_for_replacements": true
  },
  "summary": {
    "decision_count": 2,
    "blocking_count": 0,
    "requires_confirmation_count": 1,
    "requires_review_count": 1,
    "output_count": 1,
    "qa_status": "pass",
    "qa_blocking_count": 0,
    "qa_warning_count": 0,
    "unprocessed_asset_count": 0,
    "apply_summary": {
      "create": 1,
      "replace": 0,
      "unchanged": 0,
      "conflict": 0
    },
    "localization": {
      "operating_mode": "greenfield_localization",
      "reference_policy": "style_only",
      "generated_count": 1,
      "preserved_count": 0,
      "stale_count": 0,
      "missing_count": 1,
      "obsolete_count": 0,
      "review_required_count": 1
    }
  },
  "localization": {
    "operating_mode": "greenfield_localization",
    "reference_policy": "style_only",
    "generated_count": 1,
    "preserved_count": 0,
    "stale_count": 0,
    "missing_count": 1,
    "obsolete_count": 0,
    "review_required_count": 1
  },
  "apply_plan": {
    "protocol_version": "0.1",
    "run_id": "delivery-001",
    "mode": "dry_run",
    "project_root": "/workspace/example-project",
    "operations": [
      {
        "action": "create",
        "source": "/workspace/out/deliveries/delivery-001/files/locales/zh-CN.json",
        "destination": "/workspace/example-project/locales/zh-CN.json",
        "source_sha256": "aaaaaaaaaaaaaaaaaaaaaaaaaaaaaaaaaaaaaaaaaaaaaaaaaaaaaaaaaaaaaaaa",
        "destination_sha256": null
      }
    ],
    "summary": {
      "create": 1,
      "replace": 0,
      "unchanged": 0,
      "conflict": 0
    },
    "blocked_by_conflicts": false,
    "requires_confirmation": true
  },
  "decisions": [
    {
      "id": "apply-0001",
      "type": "apply_operation",
      "severity": "warning",
      "status": "requires_confirmation",
      "recommendation": "Apply only after the project owner confirms the run id.",
      "evidence": {
        "action": "create",
        "source": "/workspace/out/deliveries/delivery-001/files/locales/zh-CN.json",
        "destination": "/workspace/example-project/locales/zh-CN.json",
        "source_sha256": "aaaaaaaaaaaaaaaaaaaaaaaaaaaaaaaaaaaaaaaaaaaaaaaaaaaaaaaaaaaaaaaa",
        "destination_sha256": null
      }
    },
    {
      "id": "loc-0002",
      "type": "generated_candidate",
      "severity": "warning",
      "status": "requires_review",
      "recommendation": "Generated candidates require human review before apply.",
      "evidence": {
        "count": 1,
        "operating_mode": "greenfield_localization",
        "reference_policy": "style_only"
      }
    }
  ],
  "next_actions": [
    "Review this decision report before applying any staged files.",
    "Apply only with `apply-delivery --confirm-run-id delivery-001` after owner approval."
  ]
}
